timestamp,question,answer
2024-03-16 11:17:05,what is core of Orca model,"  Based on the provided context, the core of the Orca model appears to be its progressive learning capabilities from complex data sources. According to the text, Orca has been trained on a diverse set of data that simulates zero-shot settings, and it has demonstrated progressive learning in various areas such as math, coding, and reasoning. Additionally, the model is trained with diverse system instructions to elicit different kinds of responses, and it is capable of generating non-deterministic responses to different system instructions due to its stochastic nature.
Therefore, the core of Orca's model appears to be its ability to learn and adapt from complex data sources and instructions, allowing it to generate accurate and diverse outputs in a wide range of areas."
2024-03-16 11:18:56,what is the performance of Orca in zero-shot?,"  Based on the provided context, Orca's performance in zero-shot settings is not fully tested. The model's ability to generalize to unseen tasks and domains is an area of ongoing research, and there are limitations to its capabilities in this regard.
The text states that Orca has been trained on data simulating zero-shot settings with standard prompts, but the model's performance in other contexts such as multi-turn conversations, in-context learning, and few-shot learning remains untested. Additionally, the distribution of the tuning data may limit Orca's accuracy in areas underrepresented in the training dataset, such as math, coding, and reasoning.
Therefore, I cannot provide a detailed answer to the user's question regarding Orca's performance in zero-shot settings without more information about the specific task or domain being evaluated."
2024-03-16 11:20:01,,"  Based on the provided context, I would give the following ratings for each assistant's performance:
For Assistant 1:
* Helpfulness: 6/10
Assistant 1 provides a relevant and accurate answer to the user's question, but their response is not as detailed or comprehensive as Assistant 2's answer.

For Assistant 2:
* Helpfulness: 8/10
Assistant 2 provides a more detailed and comprehensive answer to the user's question, addressing all aspects of the user's request and providing additional information on the topic. Their response is also more helpful in terms of providing examples and supporting evidence for their claims.

In terms of overall performance, I would give Assistant 2 a slightly higher score than Assistant 1, as they demonstrated a better ability to address the user's question and provide relevant and accurate information."
2024-03-16 11:21:50,what is expectation in future development of llama2,"  Based on the provided context, the user is asking about the expectations for the future development of LLama2, a large language model developed by Tatsu-Lab. The context mentions several papers and works that have been done in this area, including the development of tool-augmented LFMs, which are expected to address some of the limitations of large language models, such as lack of contextual understanding, data biases, and lack of transparency.
In terms of expectations for the future development of LLama2, it is likely that researchers will continue to explore ways to improve its performance and capabilities, such as by incorporating new techniques or architectures, or by developing new plugins or tools to enhance its functionality. Additionally, there may be a focus on improving the model's ability to understand and generate text that is more contextually appropriate and coherent, as well as on addressing any potential biases or unfairness in the model's outputs.
It is also possible that future developments in LLama2 will involve incorporating new types of data or information, such as knowledge from external sources or information from other modalities, to improve the model's ability to understand and generate text that is more comprehensive and accurate. Overall, the future development of LLama2 is likely to be shaped by a combination of technological advancements and researchers' ongoing efforts to improve the model's performance and capabilities."
2024-03-17 16:26:52,what are ORCA main 2 features?,"  As an assistant, I'm happy to help you with your questions! Based on the provided context, here are two main features of Orca:
1. Data Biases: Orca, built upon the LLaMA model family, may carry biases present in the source data used for training, which could result in potentially biased or unfair outputs.
2. Lack of Transparency: Due to the complexity and size of large language models like Orca, they can act as ""black boxes,"" making it difficult to comprehend the rationale behind specific outputs or decisions. It's important to review transparency notes from Azure for more information on this matter."
2024-03-17 16:45:07,how perfom ORCA compared with other models  features?,"  Based on the provided context, I can answer your question. Orca performs better than Vicuna in terms of entailment and semantic understanding, achieving a 4.5% improvement in the formal fallacies task. However, Orca significantly lags GPT-4 in performance across all tasks, with an average gap of 26%.
In comparison to Text-da-Vinci-003, Orca performs on par with this model but lags ChatGPT by 5 points. Additionally, Orca shows a relative improvement of 42% compared to Vicuna in all categories.
Regarding the loss function used for training Orca, it is computed only on the tokens generated by the teacher model, ensuring that the model focuses on learning from the most relevant and informative tokens.
The training process for Orca involved training the model on 20 NVIDIA A100 GPUs with 80GB memory, taking 160 hours to train on FLAN-5M (ChatGPT augmentations) for 4 epochs and 40 hours to continue training on FLAN-1M (GPT-4 augmentations) for the same number of epochs. Collecting data from GPT-3.5-turbo (ChatGPT) and GPT-4 required 2 weeks and 3 weeks, respectively, accounting for throttling limits, endpoint load, and length distribution of query and response pairs.
In summary, Orca performs better than Vicuna in certain areas but lags significantly behind ChatGPT across all tasks. The loss function used for training ensures that the model focuses on learning from the most relevant tokens, and the training process involved using 20 NVIDIA A100 GPUs with 80GB memory."
2024-03-18 06:05:49,what are nylon features ?,"  Based on the provided context, nylon is a type of polymer that has several notable features. Here are some of the key features of nylon:
Strength and Toughness: Nylon is known for its high strength-to-weight ratio and toughness, making it an excellent choice for high-performance applications.
Thermal Resistance: Nylon has good thermal resistance, meaning it can withstand high temperatures without degrading or losing its shape.
Moisture Absorption: Nylon is sensitive to moisture absorption, which can affect its properties and performance in certain applications.
Dimensional Stability: Nylon has good dimensional stability, which makes it useful in applications where accuracy and precision are critical.
Hydrogen Bonding: Nylon has a high hydrogen bond density, which provides additional strength and rigidity to the polymer chain.
Semi-Aromatic Structure: Some types of nylon have a semi-aromatic structure, which gives them enhanced chemical resistance and improved heat stability.
Polyamide Backbone: Nylon is a polyamide, meaning it has a backbone composed of amide groups (-N=C=-). This structure provides additional strength and rigidity to the polymer chain.
Thermoplastic: Nylon is a thermoplastic, meaning it can be melted and reformed multiple times without undergoing any significant chemical changes.

Based on the provided context, these are some of the key features of nylon. If you have any specific questions about nylon or its applications, feel free to ask!"
2024-03-18 07:37:14,what are the main features of nylon ?,"  Based on the provided context, nylon is a type of polymer that has several main features:
1. Strength and Durability: Nylon is known for its high strength-to-weight ratio, making it a popular choice for high-performance applications where durability is crucial.
2. Thermal and Chemical Resistance: Nylon has excellent thermal and chemical resistance, making it suitable for applications in harsh environments.
3. Moisture Absorption: Nylon can absorb moisture, which can be beneficial in textiles but can also reduce its dimensional stability in other applications.
4. Hydrogen Bonding: Nylon has a high hydrogen bond density, which can improve its thermal stability and dimensional stability.
5. Aromatic Nature: Some types of nylon are aromatic, which means they have a specific type of chemical bond that provides additional strength and stability.
6. Variety of Applications: Nylon is used in a wide range of applications, including automotive parts, outdoor gear, industrial fishing equipment, carpet, and many more.
Based on the context, nylon is a versatile material with unique properties that make it suitable for various applications. However, it also has some drawbacks, such as moderate Tg values and a trade-off between strength, Tm, and H2O absorption, which need to be considered when selecting a nylon material for a specific application."
2024-03-18 07:43:19,what is the stiffness of PA6 ,"  Based on the provided context, the stiffness of PA6 (Nylon 6) is not directly mentioned or discussed. The authors of the paper focused on the friction behavior of PA6 and PEEK (Polyetheretherketone) composites in small-scale tribology model systems, and their surface characteristics.
However, in one of the references cited in the paper [25], the interlaminar failure behavior of carbon fiber/polyetheretherketone composites is discussed, and the authors mention that the stiffness of carbon fibers is typically in the range of 100-200 GPa (gigapascals). This value is higher than that of most polymers, including PA6, which typically has a stiffness in the range of 1-10 GPa.
Therefore, based on this information, it can be inferred that PA6 has a stiffness lower than that of carbon fibers, but higher than that of most other polymers. However, without direct mention or measurement of the stiffness of PA6 in the provided context, this is only an inference based on the reference provided."
2024-03-18 07:49:30,is nylon suitable for metal replacement?,"  Based on the provided context, yes, nylon is suitable for metal replacement in certain applications. The EMS Group has been specializing in metal replacement using high-performance polymers, including nylon, since the transition to high-performance polymers in the 1960s/1970s. The company has been successful in replacing components for industrial and consumer applications with parts made of high-performance polymers, including nylon, that are lighter in weight, less expensive, but just as tough as metal components.
The context highlights that nylon is one of the specialty products used by EMS in their business model, particularly in the automotive industry. Nylon is known for its high strength-to-weight ratio, which makes it an attractive alternative to metal for weight-sensitive applications. Additionally, nylon has good chemical resistance and high temperature stability, which makes it suitable for use in high-temperature applications.
While the context does not provide detailed information on the specific properties of nylon, it does highlight that its performance can be characterized using standardized tests and compared with incumbent materials bioproducts. The text also notes that commercial polymer products often contain trace amounts of co-monomers and/or additives that can affect their properties, so it is important to synthesize nylon or obtain data using purchased standards with known compositions to ensure accurate comparisons.
Overall, based on the information provided in the context, nylon is a suitable material for metal replacement in certain applications, particularly in the automotive industry where weight reduction is a key concern."
2024-03-18 20:13:12,what is the definition of stiffness,"  As a helpful assistant, I'm glad to help you with your question! Based on the provided context, stiffness is not explicitly defined or discussed. However, we can infer some information about stiffness from the context.
Stiffness is a measure of how much a material resists deformation when a force is applied to it. In other words, it's a measure of how rigid or inflexible a material is. In the context of polymer physics, stiffness is an important property that determines how much a polymer can deform under an applied force without breaking or undergoing plastic flow.
From the text, we know that polymers exhibit non-uniform deformation when subjected to mechanical stress. This suggests that polymers have a non-uniform stiffness distribution within their structure. The degree of non-uniformity depends on factors such as the polymer's chemical structure, crystallinity, and processing conditions.
In summary, while the term ""stiffness"" is not explicitly defined in the provided context, we can infer that it refers to the polymer's resistance to deformation under applied forces, which is influenced by factors such as the polymer's chemical structure and processing conditions."
2024-03-18 21:03:13,what is the stiffness of PA6,"  Based on the provided context, the stiffness of PA6 (Polyamide 6) can be determined from the data presented in Figure 9. The Young modulus E is calculated from the tangent line in the elastic domain (between 0.05 and 0.25% of true strain) and the yield stress σy is defined as the observed maximum stress.
From Figure 9, we can see that the Young modulus E for PA6 increases with temperature, reaching a maximum value of approximately 340 MPa at 250°C. This indicates that PA6 is stiffer at higher temperatures.
Moreover, from the same figure, we can observe that the yield stress σy also increases with temperature, reaching a maximum value of approximately 180 MPa at 250°C. This indicates that PA6 becomes more ductile at higher temperatures.
Therefore, based on the provided context, we can conclude that the stiffness of PA6 is approximately 340 MPa at 250°C, which indicates that it is a relatively stiff material."
2024-03-18 22:05:51,what are the main features of polyammides,"  Based on the provided context, polyamides are a class of engineering materials that are characterized by their unique properties and applications. The main features of polyamides include:
1. Strong mechanical properties: Polyamides have high tensile strength, modulus of elasticity, and impact resistance, making them suitable for applications that require structural integrity and durability.
2. Thermal stability: Polyamides have excellent thermal stability, with high melting points and good resistance to thermal degradation, making them suitable for high-temperature applications.
3. Chemical resistance: Polyamides have good chemical resistance, with resistance to various organic and inorganic solvents, making them suitable for applications in harsh environments.
4. Electrical properties: Polyamides have good electrical insulation properties, making them suitable for applications in electrical engineering.
5. Processability: Polyamides can be processed using various methods, such as injection molding, extrusion, and fiber spinning, making them suitable for a wide range of applications.
6. Sustainability: Polyamides are made from renewable resources, such as corn starch and sugarcane, making them a sustainable alternative to traditional engineering materials.
7. Modular structure: Polyamides have a modular structure, consisting of repeating units of diamines and polycarboxylic acids, making them suitable for tailoring their properties through molecular design.
8. Blendability: Polyamides can be blended with other polymers to achieve specific properties and applications, making them suitable for applications that require specific properties.
9. Biodegradability: Polyamides have been shown to be biodegradable under certain conditions, making them suitable for applications that require environmental sustainability.
10. Biocompatibility: Polyamides have been shown to be biocompatible, making them suitable for applications in medical devices and implants.

Based on the above features, polyamides are used in various applications such as:
1. Automotive: Polyamides are used in various automotive parts such as engine mounts, bushings, and insulation materials due to their high strength-to-weight ratio, thermal stability, and resistance to chemicals.
2. Aerospace: Polyamides are used in aerospace applications due to their high strength-to-weight ratio, thermal stability, and resistance to chemicals. They are used in various parts such as aircraft structures, engine components, and insulation materials.
3. Electronics: Polyamides are used in various electronic applications due to their electrical insulation properties, chemical resistance, and dimensional stability. They are used in various parts such as printed circuit boards, potting materials, and insulation materials.
4. Medical devices: Polyamides are used in various medical devices such as implants, sutures, and drug delivery systems due to their biocompatibility, biodegradability, and mechanical properties.
5. Sports equipment: Polyamides are used in various sports equipment such as bicycle frames, skis, and snowboards due to their high strength-to-weight ratio, stiffness, and resistance to fatigue.
6. Packaging: Polyamides are used in various packaging applications such as bottles, containers, and lids due to their good barrier properties, chemical resistance, and mechanical strength."
2024-03-24 08:13:21,what are the main features of nylon ?,"  Based on the provided context, nylon is a type of polymer that has several main features:
1. Strength and Durability: Nylon is known for its high strength-to-weight ratio, making it a popular choice for applications that require durability and resistance to wear and tear.
2. Thermal Resistance: Nylon has good thermal stability, making it suitable for high-temperature applications. It can withstand temperatures up to 280°C (536°F).
3. Chemical Resistance: Nylon is resistant to many chemicals, including organic and inorganic compounds. It is also resistant to water absorption, which makes it useful for applications where dimensional stability is important.
4. Hydrophobicity: Nylon is hydrophobic, meaning it repels water. This property makes it useful for applications such as outdoor gear, industrial fishing equipment, and carpet.
5. Moisture Absorption: Nylon absorbs moisture, which can affect its properties and performance. The amount of moisture absorption depends on the type of nylon and its molecular structure.
6. Aromaticity: Some types of nylon, such as nylon 11, are aromatic, meaning they have a planar, unsaturated molecular structure. This property can give them unique properties and applications.
7. Melting Point: The melting point of nylon varies depending on its type, with nylon 11 having a higher melting point than other types of nylon.
8. Crystallinity: Nylon can be crystalline or amorphous, depending on its molecular structure and processing conditions. The crystallinity of nylon affects its properties, such as strength, toughness, and thermal stability.
9. Molecular Weight: The molecular weight of nylon affects its properties, such as strength, toughness, and melting point. Higher molecular weight nylon generally has better properties.
10. Applications: Nylon is used in a wide range of applications, including textiles, industrial fishing equipment, automotive parts, outdoor gear, and carpet. Its strength, durability, and resistance to water make it a popular choice for these applications.

Based on the provided context, these are some of the main features of nylon that are relevant to its properties and applications."
2024-03-30 21:02:36, what influence in the molding process has lowering the melt temperature entering the sprue,"  Based on the provided context, lowering the melt temperature entering the sprue in the injection molding process can have several influences on the final product. Here are some possible effects:
1. Reduced shrinkage: Lowering the melt temperature can result in reduced shrinkage, as there is less material to be melted and packed into the mold. This can lead to smaller part weights and reduced sink marks.
2. Increased flow distance: Lowering the melt temperature can increase the flow distance, as the material takes longer to melt and flow into the mold. This can result in better fill levels and reduced voids in the part.
3. Improved surface finish: Lowering the melt temperature can improve the surface finish of the part, as the material takes longer to solidify and exhibit thermal shrinkage. This can result in smoother surfaces and reduced warpage.
4. Reduced mold temperature: Lowering the melt temperature can reduce the mold temperature required to maintain the desired melt temperature during the injection molding process. This can reduce the amount of heat generated during the process and result in reduced mold wear and tear.
However, lowering the melt temperature too much can also have negative effects, such as increased molding times, reduced packing pressure, and potential sink marks. Therefore, it is important to carefully consider the optimal melt temperature range for a specific part design and material properties."
